{
  "schemaVersion": "2.0",
  "title": "跨平台演示验证",
  "language": "zh-CN",
  "audience": "安装使用者",
  "purpose": "验证可编辑输出与素材完整性",
  "brand": {
    "name": "Leego 示例"
  },
  "theme": "purple-tech",
  "style": {
    "fontFace": "Source Han Sans SC"
  },
  "slides": [
    {
      "id": "cover",
      "narrativeJob": "说明样例性质",
      "layout": "cover",
      "title": "同一套规范，跨平台生成",
      "body": "以下均为合成示例，用于验证文字、图片和数据的输出。"
    },
    {
      "id": "contain",
      "narrativeJob": "完整呈现竖幅图片",
      "layout": "split-visual",
      "title": "竖幅证据保留完整边界",
      "visuals": [
        {
          "src": "portrait.png",
          "alt": "合成紫框测试图",
          "fit": "contain",
          "caption": "完整边框必须全部可见"
        }
      ],
      "items": [
        {
          "title": "先保全貌",
          "body": "图片保持比例；避免为了填满区域裁去关键信息。"
        }
      ]
    },
    {
      "id": "crop",
      "narrativeJob": "核验焦点裁切",
      "layout": "dual-screenshot",
      "title": "全貌与局部并列说明",
      "visuals": [
        {
          "src": "portrait.png",
          "alt": "完整合成图",
          "fit": "contain",
          "caption": "全貌"
        },
        {
          "src": "portrait.png",
          "alt": "中心焦点合成图",
          "fit": "cover",
          "focalPoint": {
            "x": 0.5,
            "y": 0.5
          },
          "caption": "明确标注的细节裁切"
        }
      ]
    },
    {
      "id": "table",
      "narrativeJob": "比较状态",
      "layout": "table",
      "title": "未知状态保留为未知",
      "table": {
        "columns": [
          "对象",
          "数量（示例）",
          "状态"
        ],
        "rows": [
          [
            "方案一",
            12,
            "已核验"
          ],
          [
            "方案二",
            null,
            "待核验"
          ],
          [
            "方案三",
            0,
            "已核验"
          ]
        ]
      },
      "sources": [
        "来源：合成验证数据，不代表实际业务"
      ]
    },
    {
      "id": "chart",
      "narrativeJob": "比较数量",
      "layout": "chart",
      "title": "图表保留单位、期间和来源",
      "chart": {
        "type": "bar",
        "unit": "件（示例）",
        "period": "示例第 1–3 周",
        "labels": [
          "第一周",
          "第二周",
          "第三周"
        ],
        "series": [
          {
            "name": "序列一",
            "values": [
              20,
              30,
              25
            ]
          },
          {
            "name": "序列二",
            "values": [
              15,
              22,
              28
            ]
          }
        ]
      },
      "sources": [
        "来源：合成验证数据"
      ]
    },
    {
      "id": "line",
      "narrativeJob": "展示变化",
      "layout": "chart",
      "title": "原始数据可继续编辑",
      "chart": {
        "type": "line",
        "unit": "项（示例）",
        "period": "示例第 1–3 周",
        "labels": [
          "第一周",
          "第二周",
          "第三周"
        ],
        "series": [
          {
            "name": "变化",
            "values": [
              -3,
              0,
              5
            ]
          }
        ]
      },
      "sources": [
        "来源：合成验证数据"
      ]
    }
  ]
}
